{
  "app_version": "1.0.0",
  "file_type": "pyside6-theme-playground",
  "file_version": 1,
  "generated_qss": "\nQMainWindow, QWidget { background-color: #262624; color: #F5F4EE; font-size: 10pt; }\n\nQGroupBox {\n    border: 1px solid #46453F;\n    border-radius: 8px;\n    margin-top: 22px;\n    padding-top: 4px;\n    font-weight: bold;\n    color: #C96442;\n}\nQGroupBox::title {\n    subcontrol-origin: margin;\n    left: 8px;\n    padding: 0 4px;\n}\n\nQTabWidget::pane\n{\n    border: 1px solid #46453F;\n    top: -1px;\n}\n\nQTabBar::tab\n{\n    background-color: #2F2E2B;\n    color: #F5F4EE;\n    padding: 8px 18px;\n    border: 1px solid #46453F;\n    border-top-left-radius: 8px;\n    border-top-right-radius: 8px;\n    min-width: 70px;\n}\n\nQTabBar::tab:selected\n{\n    background-color: #3A3936;\n    color: #C96442;\n    font-weight: 600;\n    margin-bottom: 0px;\n}\n\nQTabBar::tab:hover\n{\n    background-color: #C96442;\n    color: #1F1E1C;\n}\n\nQTabBar::tab:!selected\n{\n    margin-top: 2px;\n}\n\nQListWidget { background-color: #2F2E2B; }\nQListWidget::item:selected { background-color: #C96442; color: #1F1E1C; }\n\nQTableView {\n    background-color: #2F2E2B;\n    alternate-background-color: #262624;\n    color: #F5F4EE;\n    gridline-color: #46453F;\n    selection-background-color: #3A3936;\n}\nQHeaderView::section {\n    background-color: #3A3936;\n    color: #C96442;\n    border: 1px solid #46453F;\n    padding: 3px;\n    font-weight: bold;\n}\nQTableWidget {\n    background-color: #2F2E2B;\n    color: #F5F4EE;\n    gridline-color: #46453F;\n}\n\n/* ---- Global input sizing ---------------------------------------------- */\nQLineEdit, QComboBox, QSpinBox, QDoubleSpinBox, QDateEdit, QTimeEdit,\nQDateTimeEdit, QPlainTextEdit, QAbstractSpinBox {\n    background-color: #3A3936;\n    color: #F5F4EE;\n    border: 1px solid #46453F;\n    border-radius: 7px;\n    min-height: 28px;\n    padding-top: 4px;\n    padding-bottom: 4px;\n    padding-left: 4px;\n    padding-right: 4px;\n}\nQComboBox QAbstractItemView {\n    background: #3A3936;\n    color: #F5F4EE;\n    selection-background-color: #C96442;\n    selection-color: #1F1E1C;\n}\nQComboBox QAbstractItemView::item { min-height: 28px; }\nQComboBox::drop-down { border: none; min-height: 28px; }\n\nQTextEdit {\n    background-color: #2F2E2B;\n    color: #F5F4EE;\n    border: 1px solid #46453F;\n}\n\nQPushButton {\n    background-color: #3A3936;\n    color: #F5F4EE;\n    border: 1px solid #46453F;\n    border-radius: 8px;\n    padding: 5px 10px;\n}\nQPushButton:hover { background-color: #C96442; color: #1F1E1C; }\nQPushButton:disabled { color: #A8A49A; border-color: #46453F; }\n\n/* ---- Named action buttons (set via objectName) ------------------------ */\nQPushButton#btnConnect    { background-color: #5C8A4A;     color: #1F1E1C; font-weight: bold; }\nQPushButton#btnDisconnect { background-color: #C0563E;  color: #1F1E1C; }\nQPushButton#btnRead       { background-color: #5C8A4A;        color: #1F1E1C; font-weight: bold; }\nQPushButton#btnWrite      { background-color: #4A7DA8;       color: #1F1E1C; font-weight: bold; }\nQPushButton#btnWriteRead  { background-color: #9A6BB0;  color: #1F1E1C; font-weight: bold; }\nQPushButton#btnScan       { background-color: #C9874A;        color: #1F1E1C; font-weight: bold; }\nQPushButton#btnApply      { font-weight: bold; }\nQPushButton#btnSpyStart   { background-color: #5C8A4A;     color: #1F1E1C; font-weight: bold; font-size: 13px; padding: 6px; }\nQPushButton#btnSpyStop    { background-color: #C0563E;  color: #1F1E1C; font-weight: bold; font-size: 13px; padding: 6px; }\n\nQLabel#specgenSectionHeading {\n    font-size: 13pt;\n    font-weight: 600;\n    color: #F5F4EE;\n    margin-top: 8px;\n    margin-bottom: 4px;\n}\n\nQLabel#noteLabel { color: #E0A458; font-size: 10px; }\nQLabel#mutedLabel { color: #A8A49A; }\n/* [XREF: file-picker] validated file-status line colors */\nQLabel#statusOk { color: #7FB069; }\nQLabel#statusError { color: #D9785E; }\n\nQPushButton[saveDirty=\"true\"] {\n    background-color: #5C8A4A;\n    color: #1F1E1C;\n    font-weight: 600;\n    border-radius: 7px;\n    padding: 4px 12px;\n}\nQPushButton[saveDirty=\"true\"]:hover { background-color: #6B9E57; }\n\nQStatusBar { background-color: #3A3936; color: #F5F4EE; }\nQSplitter::handle { background: #46453F; }\nQScrollBar:vertical { background: #262624; width: 10px; }\nQScrollBar::handle:vertical { background: #46453F; border-radius: 4px; min-height: 20px; }\nQCheckBox { color: #F5F4EE; spacing: 5px; }\nQRadioButton { color: #F5F4EE; spacing: 6px; }\nQProgressDialog { background-color: #262624; color: #F5F4EE; }\n",
  "palette": {
    "accent_primary": "#C96442",
    "action_apply": "#C96442",
    "action_connect": "#5C8A4A",
    "action_disconnect": "#C0563E",
    "action_read": "#5C8A4A",
    "action_scan": "#C9874A",
    "action_text": "#1F1E1C",
    "action_write": "#4A7DA8",
    "action_write_read": "#9A6BB0",
    "bg_primary": "#262624",
    "bg_secondary": "#2F2E2B",
    "bg_selected": "#C96442",
    "bg_tertiary": "#3A3936",
    "border_primary": "#46453F",
    "data_nak": "#D9785E",
    "data_pec_fail_bg": "#3F2420",
    "data_read": "#7FB069",
    "data_write": "#6FA8D0",
    "save_dirty_bg": "#5C8A4A",
    "save_dirty_hover": "#6B9E57",
    "save_dirty_text": "#1F1E1C",
    "section_heading_color": "#F5F4EE",
    "status_active": "#7FB069",
    "status_error": "#D9785E",
    "status_idle": "#A8A49A",
    "status_warning": "#E0A458",
    "text_inverse": "#1F1E1C",
    "text_muted": "#A8A49A",
    "text_primary": "#F5F4EE"
  },
  "preset_name": "clay",
  "settings": {
    "base_font_size": 10,
    "button_fixed_width": 130,
    "button_layout": "Mixed",
    "control_radius": 8,
    "document_mode": false,
    "font_family": "",
    "group_box_title_mode": "Above Border",
    "input_min_height": 28,
    "input_v_padding": 4,
    "pane_border": true,
    "qt_style": "Fusion",
    "section_heading_size": 13,
    "section_heading_weight": 600,
    "selected_tab_margin_bottom": 0,
    "tab_draw_base": true,
    "tab_padding_h": 18,
    "tab_padding_v": 8,
    "tab_pane_top_offset": -1,
    "tab_position": "North",
    "tab_qss_mode": "Styled QSS",
    "tab_shape": "Rounded",
    "table_row_height": 26
  }
}
