{
  "app_version": "1.0.0",
  "file_type": "pyside6-theme-playground",
  "file_version": 1,
  "generated_qss": "\nQMainWindow, QWidget { background-color: #FDF6E3; color: #586E75; font-size: 10pt; }\n\nQGroupBox {\n    border: 1px solid #D3CBB7;\n    border-radius: 3px;\n    margin-top: 8px;\n    padding-top: 0px;\n    font-weight: bold;\n    color: #268BD2;\n}\nQGroupBox::title {\n    subcontrol-origin: margin;\n    left: 8px;\n    padding: 0 4px;\n}\n\nQTabWidget::pane\n{\n    border: 1px solid #D3CBB7;\n    top: -1px;\n}\n\nQTabBar::tab\n{\n    background-color: #EEE8D5;\n    color: #586E75;\n    padding: 6px 12px;\n    border: 1px solid #D3CBB7;\n    border-top-left-radius: 3px;\n    border-top-right-radius: 3px;\n    min-width: 70px;\n}\n\nQTabBar::tab:selected\n{\n    background-color: #E4DDC8;\n    color: #268BD2;\n    font-weight: 600;\n    margin-bottom: 0px;\n}\n\nQTabBar::tab:hover\n{\n    background-color: #268BD2;\n    color: #FDF6E3;\n}\n\nQTabBar::tab:!selected\n{\n    margin-top: 2px;\n}\n\nQListWidget { background-color: #EEE8D5; }\nQListWidget::item:selected { background-color: #268BD2; color: #FDF6E3; }\n\nQTableView {\n    background-color: #EEE8D5;\n    alternate-background-color: #FDF6E3;\n    color: #586E75;\n    gridline-color: #D3CBB7;\n    selection-background-color: #E4DDC8;\n}\nQHeaderView::section {\n    background-color: #E4DDC8;\n    color: #268BD2;\n    border: 1px solid #D3CBB7;\n    padding: 3px;\n    font-weight: bold;\n}\nQTableWidget {\n    background-color: #EEE8D5;\n    color: #586E75;\n    gridline-color: #D3CBB7;\n}\n\n/* ---- Global input sizing ---------------------------------------------- */\nQLineEdit, QComboBox, QSpinBox, QDoubleSpinBox, QDateEdit, QTimeEdit,\nQDateTimeEdit, QPlainTextEdit, QAbstractSpinBox {\n    background-color: #E4DDC8;\n    color: #586E75;\n    border: 1px solid #D3CBB7;\n    border-radius: 2px;\n    min-height: 28px;\n    padding-top: 4px;\n    padding-bottom: 4px;\n    padding-left: 4px;\n    padding-right: 4px;\n}\nQComboBox QAbstractItemView {\n    background: #E4DDC8;\n    color: #586E75;\n    selection-background-color: #268BD2;\n    selection-color: #FDF6E3;\n}\nQComboBox QAbstractItemView::item { min-height: 28px; }\nQComboBox::drop-down { border: none; min-height: 28px; }\n\nQTextEdit {\n    background-color: #EEE8D5;\n    color: #586E75;\n    border: 1px solid #D3CBB7;\n}\n\nQPushButton {\n    background-color: #E4DDC8;\n    color: #586E75;\n    border: 1px solid #D3CBB7;\n    border-radius: 3px;\n    padding: 5px 10px;\n}\nQPushButton:hover { background-color: #268BD2; color: #FDF6E3; }\nQPushButton:disabled { color: #93A1A1; border-color: #D3CBB7; }\n\n/* ---- Named action buttons (set via objectName) ------------------------ */\nQPushButton#btnConnect    { background-color: #859900;     color: #FDF6E3; font-weight: bold; }\nQPushButton#btnDisconnect { background-color: #DC322F;  color: #FDF6E3; }\nQPushButton#btnRead       { background-color: #859900;        color: #FDF6E3; font-weight: bold; }\nQPushButton#btnWrite      { background-color: #268BD2;       color: #FDF6E3; font-weight: bold; }\nQPushButton#btnWriteRead  { background-color: #6C71C4;  color: #FDF6E3; font-weight: bold; }\nQPushButton#btnScan       { background-color: #CB4B16;        color: #FDF6E3; font-weight: bold; }\nQPushButton#btnApply      { font-weight: bold; }\nQPushButton#btnSpyStart   { background-color: #859900;     color: #FDF6E3; font-weight: bold; font-size: 13px; padding: 6px; }\nQPushButton#btnSpyStop    { background-color: #DC322F;  color: #FDF6E3; font-weight: bold; font-size: 13px; padding: 6px; }\n\nQLabel#specgenSectionHeading {\n    font-size: 13pt;\n    font-weight: 600;\n    color: #586E75;\n    margin-top: 8px;\n    margin-bottom: 4px;\n}\n\nQLabel#noteLabel { color: #B58900; font-size: 10px; }\nQLabel#mutedLabel { color: #93A1A1; }\n/* [XREF: file-picker] validated file-status line colors */\nQLabel#statusOk { color: #859900; }\nQLabel#statusError { color: #DC322F; }\n\nQPushButton[saveDirty=\"true\"] {\n    background-color: #859900;\n    color: #FDF6E3;\n    font-weight: 600;\n    border-radius: 2px;\n    padding: 4px 12px;\n}\nQPushButton[saveDirty=\"true\"]:hover { background-color: #96AB00; }\n\nQStatusBar { background-color: #E4DDC8; color: #586E75; }\nQSplitter::handle { background: #D3CBB7; }\nQScrollBar:vertical { background: #FDF6E3; width: 10px; }\nQScrollBar::handle:vertical { background: #D3CBB7; border-radius: 4px; min-height: 20px; }\nQCheckBox { color: #586E75; spacing: 5px; }\nQRadioButton { color: #586E75; spacing: 6px; }\nQProgressDialog { background-color: #FDF6E3; color: #586E75; }\n",
  "palette": {
    "accent_primary": "#268BD2",
    "action_apply": "#268BD2",
    "action_connect": "#859900",
    "action_disconnect": "#DC322F",
    "action_read": "#859900",
    "action_scan": "#CB4B16",
    "action_text": "#FDF6E3",
    "action_write": "#268BD2",
    "action_write_read": "#6C71C4",
    "bg_primary": "#FDF6E3",
    "bg_secondary": "#EEE8D5",
    "bg_selected": "#268BD2",
    "bg_tertiary": "#E4DDC8",
    "border_primary": "#D3CBB7",
    "data_nak": "#DC322F",
    "data_pec_fail_bg": "#F8DDDA",
    "data_read": "#859900",
    "data_write": "#268BD2",
    "save_dirty_bg": "#859900",
    "save_dirty_hover": "#96AB00",
    "save_dirty_text": "#FDF6E3",
    "section_heading_color": "#586E75",
    "status_active": "#859900",
    "status_error": "#DC322F",
    "status_idle": "#93A1A1",
    "status_warning": "#B58900",
    "text_inverse": "#FDF6E3",
    "text_muted": "#93A1A1",
    "text_primary": "#586E75"
  },
  "preset_name": "solarized light",
  "settings": {
    "base_font_size": 10,
    "button_fixed_width": 130,
    "button_layout": "Mixed",
    "control_radius": 3,
    "document_mode": false,
    "font_family": "",
    "group_box_title_mode": "On Border",
    "input_min_height": 28,
    "input_v_padding": 4,
    "pane_border": true,
    "qt_style": "Fusion",
    "section_heading_size": 13,
    "section_heading_weight": 600,
    "selected_tab_margin_bottom": 0,
    "tab_draw_base": true,
    "tab_padding_h": 12,
    "tab_padding_v": 6,
    "tab_pane_top_offset": -1,
    "tab_position": "North",
    "tab_qss_mode": "Styled QSS",
    "tab_shape": "Rounded",
    "table_row_height": 26
  }
}
