{
  "app_version": "1.0.0",
  "file_type": "pyside6-theme-playground",
  "file_version": 1,
  "generated_qss": "\nQMainWindow, QWidget { background-color: #0D1117; color: #E6EDF3; font-size: 10pt; }\n\nQGroupBox {\n    border: 1px solid #30363D;\n    border-radius: 4px;\n    margin-top: 8px;\n    padding-top: 0px;\n    font-weight: bold;\n    color: #00D4FF;\n}\nQGroupBox::title {\n    subcontrol-origin: margin;\n    left: 8px;\n    padding: 0 4px;\n}\n\nQTabWidget::pane\n{\n    border: 1px solid #30363D;\n    top: -1px;\n}\n\nQTabBar::tab\n{\n    background-color: #161B22;\n    color: #E6EDF3;\n    padding: 6px 12px;\n    border: 1px solid #30363D;\n    border-top-left-radius: 4px;\n    border-top-right-radius: 4px;\n    min-width: 70px;\n}\n\nQTabBar::tab:selected\n{\n    background-color: #1C232C;\n    color: #00D4FF;\n    font-weight: 600;\n    margin-bottom: 0px;\n}\n\nQTabBar::tab:hover\n{\n    background-color: #238636;\n    color: #FFFFFF;\n}\n\nQTabBar::tab:!selected\n{\n    margin-top: 2px;\n}\n\nQListWidget { background-color: #161B22; }\nQListWidget::item:selected { background-color: #238636; color: #FFFFFF; }\n\nQTableView {\n    background-color: #161B22;\n    alternate-background-color: #0D1117;\n    color: #E6EDF3;\n    gridline-color: #30363D;\n    selection-background-color: #1C232C;\n}\nQHeaderView::section {\n    background-color: #1C232C;\n    color: #00D4FF;\n    border: 1px solid #30363D;\n    padding: 3px;\n    font-weight: bold;\n}\nQTableWidget {\n    background-color: #161B22;\n    color: #E6EDF3;\n    gridline-color: #30363D;\n}\n\n/* ---- Global input sizing ---------------------------------------------- */\nQLineEdit, QComboBox, QSpinBox, QDoubleSpinBox, QDateEdit, QTimeEdit,\nQDateTimeEdit, QPlainTextEdit, QAbstractSpinBox {\n    background-color: #1C232C;\n    color: #E6EDF3;\n    border: 1px solid #30363D;\n    border-radius: 3px;\n    min-height: 28px;\n    padding-top: 4px;\n    padding-bottom: 4px;\n    padding-left: 4px;\n    padding-right: 4px;\n}\nQComboBox QAbstractItemView {\n    background: #1C232C;\n    color: #E6EDF3;\n    selection-background-color: #238636;\n    selection-color: #FFFFFF;\n}\nQComboBox QAbstractItemView::item { min-height: 28px; }\nQComboBox::drop-down { border: none; min-height: 28px; }\n\nQTextEdit {\n    background-color: #161B22;\n    color: #E6EDF3;\n    border: 1px solid #30363D;\n}\n\nQPushButton {\n    background-color: #1C232C;\n    color: #E6EDF3;\n    border: 1px solid #30363D;\n    border-radius: 4px;\n    padding: 5px 10px;\n}\nQPushButton:hover { background-color: #238636; color: #FFFFFF; }\nQPushButton:disabled { color: #8B949E; border-color: #30363D; }\n\n/* ---- Named action buttons (set via objectName) ------------------------ */\nQPushButton#btnConnect    { background-color: #238636;     color: #0D1117; font-weight: bold; }\nQPushButton#btnDisconnect { background-color: #DA3633;  color: #0D1117; }\nQPushButton#btnRead       { background-color: #238636;        color: #0D1117; font-weight: bold; }\nQPushButton#btnWrite      { background-color: #1F6FEB;       color: #0D1117; font-weight: bold; }\nQPushButton#btnWriteRead  { background-color: #8957E5;  color: #0D1117; font-weight: bold; }\nQPushButton#btnScan       { background-color: #DB6D28;        color: #0D1117; font-weight: bold; }\nQPushButton#btnApply      { font-weight: bold; }\nQPushButton#btnSpyStart   { background-color: #238636;     color: #0D1117; font-weight: bold; font-size: 13px; padding: 6px; }\nQPushButton#btnSpyStop    { background-color: #DA3633;  color: #0D1117; font-weight: bold; font-size: 13px; padding: 6px; }\n\nQLabel#specgenSectionHeading {\n    font-size: 13pt;\n    font-weight: 600;\n    color: #E6EDF3;\n    margin-top: 8px;\n    margin-bottom: 4px;\n}\n\nQLabel#noteLabel { color: #D29922; font-size: 10px; }\nQLabel#mutedLabel { color: #8B949E; }\n/* [XREF: file-picker] validated file-status line colors */\nQLabel#statusOk { color: #3FB950; }\nQLabel#statusError { color: #DA3633; }\n\nQPushButton[saveDirty=\"true\"] {\n    background-color: #00D4A0;\n    color: #0D1117;\n    font-weight: 600;\n    border-radius: 3px;\n    padding: 4px 12px;\n}\nQPushButton[saveDirty=\"true\"]:hover { background-color: #00E8B0; }\n\nQStatusBar { background-color: #1C232C; color: #E6EDF3; }\nQSplitter::handle { background: #30363D; }\nQScrollBar:vertical { background: #0D1117; width: 10px; }\nQScrollBar::handle:vertical { background: #30363D; border-radius: 4px; min-height: 20px; }\nQCheckBox { color: #E6EDF3; spacing: 5px; }\nQRadioButton { color: #E6EDF3; spacing: 6px; }\nQProgressDialog { background-color: #0D1117; color: #E6EDF3; }\n",
  "palette": {
    "accent_primary": "#00D4FF",
    "action_apply": "#00D4FF",
    "action_connect": "#238636",
    "action_disconnect": "#DA3633",
    "action_read": "#238636",
    "action_scan": "#DB6D28",
    "action_text": "#0D1117",
    "action_write": "#1F6FEB",
    "action_write_read": "#8957E5",
    "bg_primary": "#0D1117",
    "bg_secondary": "#161B22",
    "bg_selected": "#238636",
    "bg_tertiary": "#1C232C",
    "border_primary": "#30363D",
    "data_nak": "#F85149",
    "data_pec_fail_bg": "#3D1416",
    "data_read": "#3FB950",
    "data_write": "#58A6FF",
    "save_dirty_bg": "#00D4A0",
    "save_dirty_hover": "#00E8B0",
    "save_dirty_text": "#0D1117",
    "section_heading_color": "#E6EDF3",
    "status_active": "#3FB950",
    "status_error": "#DA3633",
    "status_idle": "#8B949E",
    "status_warning": "#D29922",
    "text_inverse": "#FFFFFF",
    "text_muted": "#8B949E",
    "text_primary": "#E6EDF3"
  },
  "preset_name": "Iontra Dark",
  "settings": {
    "base_font_size": 10,
    "button_fixed_width": 130,
    "button_layout": "Mixed",
    "control_radius": 4,
    "document_mode": false,
    "font_family": "",
    "group_box_title_mode": "On Border",
    "input_min_height": 28,
    "input_v_padding": 4,
    "pane_border": true,
    "qt_style": "Fusion",
    "section_heading_size": 13,
    "section_heading_weight": 600,
    "selected_tab_margin_bottom": 0,
    "tab_draw_base": true,
    "tab_padding_h": 12,
    "tab_padding_v": 6,
    "tab_pane_top_offset": -1,
    "tab_position": "North",
    "tab_qss_mode": "Styled QSS",
    "tab_shape": "Rounded",
    "table_row_height": 26
  }
}
