{
  "app_version": "1.0.0",
  "file_type": "pyside6-theme-playground",
  "file_version": 1,
  "generated_qss": "\nQMainWindow, QWidget { background-color: #1A1D23; color: #CDD6F4; font-size: 10pt; }\n\nQGroupBox {\n    border: 1px solid #313244;\n    border-radius: 4px;\n    margin-top: 8px;\n    padding-top: 0px;\n    font-weight: bold;\n    color: #89B4FA;\n}\nQGroupBox::title {\n    subcontrol-origin: margin;\n    left: 8px;\n    padding: 0 4px;\n}\n\nQTabWidget::pane\n{\n    border: 1px solid #313244;\n    top: -1px;\n}\n\nQTabBar::tab\n{\n    background-color: #1E2128;\n    color: #CDD6F4;\n    padding: 6px 12px;\n    border: 1px solid #313244;\n    border-top-left-radius: 4px;\n    border-top-right-radius: 4px;\n    min-width: 70px;\n}\n\nQTabBar::tab:selected\n{\n    background-color: #262A33;\n    color: #89B4FA;\n    font-weight: 600;\n    margin-bottom: 0px;\n}\n\nQTabBar::tab:hover\n{\n    background-color: #89B4FA;\n    color: #1A1D23;\n}\n\nQTabBar::tab:!selected\n{\n    margin-top: 2px;\n}\n\nQListWidget { background-color: #1E2128; }\nQListWidget::item:selected { background-color: #89B4FA; color: #1A1D23; }\n\nQTableView {\n    background-color: #1E2128;\n    alternate-background-color: #1A1D23;\n    color: #CDD6F4;\n    gridline-color: #313244;\n    selection-background-color: #262A33;\n}\nQHeaderView::section {\n    background-color: #262A33;\n    color: #89B4FA;\n    border: 1px solid #313244;\n    padding: 3px;\n    font-weight: bold;\n}\nQTableWidget {\n    background-color: #1E2128;\n    color: #CDD6F4;\n    gridline-color: #313244;\n}\n\n/* ---- Global input sizing ---------------------------------------------- */\nQLineEdit, QComboBox, QSpinBox, QDoubleSpinBox, QDateEdit, QTimeEdit,\nQDateTimeEdit, QPlainTextEdit, QAbstractSpinBox {\n    background-color: #262A33;\n    color: #CDD6F4;\n    border: 1px solid #313244;\n    border-radius: 3px;\n    min-height: 28px;\n    padding-top: 4px;\n    padding-bottom: 4px;\n    padding-left: 4px;\n    padding-right: 4px;\n}\nQComboBox QAbstractItemView {\n    background: #262A33;\n    color: #CDD6F4;\n    selection-background-color: #89B4FA;\n    selection-color: #1A1D23;\n}\nQComboBox QAbstractItemView::item { min-height: 28px; }\nQComboBox::drop-down { border: none; min-height: 28px; }\n\nQTextEdit {\n    background-color: #1E2128;\n    color: #CDD6F4;\n    border: 1px solid #313244;\n}\n\nQPushButton {\n    background-color: #262A33;\n    color: #CDD6F4;\n    border: 1px solid #313244;\n    border-radius: 4px;\n    padding: 5px 10px;\n}\nQPushButton:hover { background-color: #89B4FA; color: #1A1D23; }\nQPushButton:disabled { color: #9399B2; border-color: #313244; }\n\n/* ---- Named action buttons (set via objectName) ------------------------ */\nQPushButton#btnConnect    { background-color: #40A02B;     color: #11111B; font-weight: bold; }\nQPushButton#btnDisconnect { background-color: #E64553;  color: #11111B; }\nQPushButton#btnRead       { background-color: #40A02B;        color: #11111B; font-weight: bold; }\nQPushButton#btnWrite      { background-color: #1E66F5;       color: #11111B; font-weight: bold; }\nQPushButton#btnWriteRead  { background-color: #8839EF;  color: #11111B; font-weight: bold; }\nQPushButton#btnScan       { background-color: #FE640B;        color: #11111B; font-weight: bold; }\nQPushButton#btnApply      { font-weight: bold; }\nQPushButton#btnSpyStart   { background-color: #40A02B;     color: #11111B; font-weight: bold; font-size: 13px; padding: 6px; }\nQPushButton#btnSpyStop    { background-color: #E64553;  color: #11111B; font-weight: bold; font-size: 13px; padding: 6px; }\n\nQLabel#specgenSectionHeading {\n    font-size: 13pt;\n    font-weight: 600;\n    color: #CDD6F4;\n    margin-top: 8px;\n    margin-bottom: 4px;\n}\n\nQLabel#noteLabel { color: #DF8E1D; font-size: 10px; }\nQLabel#mutedLabel { color: #9399B2; }\n/* [XREF: file-picker] validated file-status line colors */\nQLabel#statusOk { color: #40A02B; }\nQLabel#statusError { color: #E64553; }\n\nQPushButton[saveDirty=\"true\"] {\n    background-color: #40A02B;\n    color: #11111B;\n    font-weight: 600;\n    border-radius: 3px;\n    padding: 4px 12px;\n}\nQPushButton[saveDirty=\"true\"]:hover { background-color: #4CB535; }\n\nQStatusBar { background-color: #262A33; color: #CDD6F4; }\nQSplitter::handle { background: #313244; }\nQScrollBar:vertical { background: #1A1D23; width: 10px; }\nQScrollBar::handle:vertical { background: #313244; border-radius: 4px; min-height: 20px; }\nQCheckBox { color: #CDD6F4; spacing: 5px; }\nQRadioButton { color: #CDD6F4; spacing: 6px; }\nQProgressDialog { background-color: #1A1D23; color: #CDD6F4; }\n",
  "palette": {
    "accent_primary": "#89B4FA",
    "action_apply": "#89B4FA",
    "action_connect": "#40A02B",
    "action_disconnect": "#E64553",
    "action_read": "#40A02B",
    "action_scan": "#FE640B",
    "action_text": "#11111B",
    "action_write": "#1E66F5",
    "action_write_read": "#8839EF",
    "bg_primary": "#1A1D23",
    "bg_secondary": "#1E2128",
    "bg_selected": "#89B4FA",
    "bg_tertiary": "#262A33",
    "border_primary": "#313244",
    "data_nak": "#F38BA8",
    "data_pec_fail_bg": "#45161D",
    "data_read": "#A6E3A1",
    "data_write": "#89B4FA",
    "save_dirty_bg": "#40A02B",
    "save_dirty_hover": "#4CB535",
    "save_dirty_text": "#11111B",
    "section_heading_color": "#CDD6F4",
    "status_active": "#40A02B",
    "status_error": "#E64553",
    "status_idle": "#9399B2",
    "status_warning": "#DF8E1D",
    "text_inverse": "#1A1D23",
    "text_muted": "#9399B2",
    "text_primary": "#CDD6F4"
  },
  "preset_name": "Engineering Dark",
  "settings": {
    "base_font_size": 10,
    "button_fixed_width": 130,
    "button_layout": "Mixed",
    "control_radius": 4,
    "document_mode": false,
    "font_family": "",
    "group_box_title_mode": "On Border",
    "input_min_height": 28,
    "input_v_padding": 4,
    "pane_border": true,
    "qt_style": "Fusion",
    "section_heading_size": 13,
    "section_heading_weight": 600,
    "selected_tab_margin_bottom": 0,
    "tab_draw_base": true,
    "tab_padding_h": 12,
    "tab_padding_v": 6,
    "tab_pane_top_offset": -1,
    "tab_position": "North",
    "tab_qss_mode": "Styled QSS",
    "tab_shape": "Rounded",
    "table_row_height": 26
  }
}
