{
  "app_version": "1.0.0",
  "file_type": "pyside6-theme-playground",
  "file_version": 1,
  "generated_qss": "\nQMainWindow, QWidget { background-color: #FFFFFF; color: #24292F; font-size: 10pt; }\n\nQGroupBox {\n    border: 1px solid #D0D7DE;\n    border-radius: 4px;\n    margin-top: 8px;\n    padding-top: 0px;\n    font-weight: bold;\n    color: #007CA3;\n}\nQGroupBox::title {\n    subcontrol-origin: margin;\n    left: 8px;\n    padding: 0 4px;\n}\n\nQTabWidget::pane\n{\n    border: 1px solid #D0D7DE;\n    top: -1px;\n}\n\nQTabBar::tab\n{\n    background-color: #F6F8FA;\n    color: #24292F;\n    padding: 6px 12px;\n    border: 1px solid #D0D7DE;\n    border-top-left-radius: 4px;\n    border-top-right-radius: 4px;\n    min-width: 70px;\n}\n\nQTabBar::tab:selected\n{\n    background-color: #EAEEF2;\n    color: #007CA3;\n    font-weight: 600;\n    margin-bottom: 0px;\n}\n\nQTabBar::tab:hover\n{\n    background-color: #218BFF;\n    color: #FFFFFF;\n}\n\nQTabBar::tab:!selected\n{\n    margin-top: 2px;\n}\n\nQListWidget { background-color: #F6F8FA; }\nQListWidget::item:selected { background-color: #218BFF; color: #FFFFFF; }\n\nQTableView {\n    background-color: #F6F8FA;\n    alternate-background-color: #FFFFFF;\n    color: #24292F;\n    gridline-color: #D0D7DE;\n    selection-background-color: #EAEEF2;\n}\nQHeaderView::section {\n    background-color: #EAEEF2;\n    color: #007CA3;\n    border: 1px solid #D0D7DE;\n    padding: 3px;\n    font-weight: bold;\n}\nQTableWidget {\n    background-color: #F6F8FA;\n    color: #24292F;\n    gridline-color: #D0D7DE;\n}\n\n/* ---- Global input sizing ---------------------------------------------- */\nQLineEdit, QComboBox, QSpinBox, QDoubleSpinBox, QDateEdit, QTimeEdit,\nQDateTimeEdit, QPlainTextEdit, QAbstractSpinBox {\n    background-color: #EAEEF2;\n    color: #24292F;\n    border: 1px solid #D0D7DE;\n    border-radius: 3px;\n    min-height: 28px;\n    padding-top: 4px;\n    padding-bottom: 4px;\n    padding-left: 4px;\n    padding-right: 4px;\n}\nQComboBox QAbstractItemView {\n    background: #EAEEF2;\n    color: #24292F;\n    selection-background-color: #218BFF;\n    selection-color: #FFFFFF;\n}\nQComboBox QAbstractItemView::item { min-height: 28px; }\nQComboBox::drop-down { border: none; min-height: 28px; }\n\nQTextEdit {\n    background-color: #F6F8FA;\n    color: #24292F;\n    border: 1px solid #D0D7DE;\n}\n\nQPushButton {\n    background-color: #EAEEF2;\n    color: #24292F;\n    border: 1px solid #D0D7DE;\n    border-radius: 4px;\n    padding: 5px 10px;\n}\nQPushButton:hover { background-color: #218BFF; color: #FFFFFF; }\nQPushButton:disabled { color: #656D76; border-color: #D0D7DE; }\n\n/* ---- Named action buttons (set via objectName) ------------------------ */\nQPushButton#btnConnect    { background-color: #0A7A2A;     color: #FFFFFF; font-weight: bold; }\nQPushButton#btnDisconnect { background-color: #CF222E;  color: #FFFFFF; }\nQPushButton#btnRead       { background-color: #0A7A2A;        color: #FFFFFF; font-weight: bold; }\nQPushButton#btnWrite      { background-color: #0969DA;       color: #FFFFFF; font-weight: bold; }\nQPushButton#btnWriteRead  { background-color: #8250DF;  color: #FFFFFF; font-weight: bold; }\nQPushButton#btnScan       { background-color: #BC4C00;        color: #FFFFFF; font-weight: bold; }\nQPushButton#btnApply      { font-weight: bold; }\nQPushButton#btnSpyStart   { background-color: #0A7A2A;     color: #FFFFFF; font-weight: bold; font-size: 13px; padding: 6px; }\nQPushButton#btnSpyStop    { background-color: #CF222E;  color: #FFFFFF; font-weight: bold; font-size: 13px; padding: 6px; }\n\nQLabel#specgenSectionHeading {\n    font-size: 13pt;\n    font-weight: 600;\n    color: #24292F;\n    margin-top: 8px;\n    margin-bottom: 4px;\n}\n\nQLabel#noteLabel { color: #9A6700; font-size: 10px; }\nQLabel#mutedLabel { color: #656D76; }\n/* [XREF: file-picker] validated file-status line colors */\nQLabel#statusOk { color: #0A7A2A; }\nQLabel#statusError { color: #CF222E; }\n\nQPushButton[saveDirty=\"true\"] {\n    background-color: #0A7A2A;\n    color: #FFFFFF;\n    font-weight: 600;\n    border-radius: 3px;\n    padding: 4px 12px;\n}\nQPushButton[saveDirty=\"true\"]:hover { background-color: #0C8F31; }\n\nQStatusBar { background-color: #EAEEF2; color: #24292F; }\nQSplitter::handle { background: #D0D7DE; }\nQScrollBar:vertical { background: #FFFFFF; width: 10px; }\nQScrollBar::handle:vertical { background: #D0D7DE; border-radius: 4px; min-height: 20px; }\nQCheckBox { color: #24292F; spacing: 5px; }\nQRadioButton { color: #24292F; spacing: 6px; }\nQProgressDialog { background-color: #FFFFFF; color: #24292F; }\n",
  "palette": {
    "accent_primary": "#007CA3",
    "action_apply": "#007CA3",
    "action_connect": "#0A7A2A",
    "action_disconnect": "#CF222E",
    "action_read": "#0A7A2A",
    "action_scan": "#BC4C00",
    "action_text": "#FFFFFF",
    "action_write": "#0969DA",
    "action_write_read": "#8250DF",
    "bg_primary": "#FFFFFF",
    "bg_secondary": "#F6F8FA",
    "bg_selected": "#218BFF",
    "bg_tertiary": "#EAEEF2",
    "border_primary": "#D0D7DE",
    "data_nak": "#CF222E",
    "data_pec_fail_bg": "#FFEBE9",
    "data_read": "#0A7A2A",
    "data_write": "#0969DA",
    "save_dirty_bg": "#0A7A2A",
    "save_dirty_hover": "#0C8F31",
    "save_dirty_text": "#FFFFFF",
    "section_heading_color": "#24292F",
    "status_active": "#0A7A2A",
    "status_error": "#CF222E",
    "status_idle": "#656D76",
    "status_warning": "#9A6700",
    "text_inverse": "#FFFFFF",
    "text_muted": "#656D76",
    "text_primary": "#24292F"
  },
  "preset_name": "Iontra Light",
  "settings": {
    "base_font_size": 10,
    "button_fixed_width": 130,
    "button_layout": "Mixed",
    "control_radius": 4,
    "document_mode": false,
    "font_family": "",
    "group_box_title_mode": "On Border",
    "input_min_height": 28,
    "input_v_padding": 4,
    "pane_border": true,
    "qt_style": "Fusion",
    "section_heading_size": 13,
    "section_heading_weight": 600,
    "selected_tab_margin_bottom": 0,
    "tab_draw_base": true,
    "tab_padding_h": 12,
    "tab_padding_v": 6,
    "tab_pane_top_offset": -1,
    "tab_position": "North",
    "tab_qss_mode": "Styled QSS",
    "tab_shape": "Rounded",
    "table_row_height": 26
  }
}
